{
  "protocolVersion": "project-control.dsh/v1alpha1",
  "schemaVersion": "lifecycle-normalized-event/v1alpha1",
  "eventId": "evt_0198f4b2-7c3a-7d75-a5c6-6b6f39e34775",
  "eventType": "project.managed.upgraded",
  "occurredAt": "2026-08-14T12:04:00.000Z",
  "recordedAt": "2026-08-14T12:04:00.100Z",
  "sequence": 5,
  "actor": {
    "kind": "human",
    "id": "cyrus",
    "applicationId": "deepseek-harness-personal"
  },
  "target": {
    "aggregateType": "project",
    "projectId": "prj_0198f4b2-7c3a-7d15-a5c6-6b6f39e34715"
  },
  "beforeRevision": 2,
  "afterRevision": 3,
  "causation": {
    "commandId": "cmd_0198f4b2-7c3a-7d25-a5c6-6b6f39e34725",
    "commandKind": "project.upgradeManaged",
    "idempotencyKey": "project.upgrade-managed.001",
    "correlationId": "corr.lifecycle.upgrade-managed"
  },
  "provenance": {
    "sourceType": "human",
    "sourceId": "project-console:upgrade-confirmation",
    "applicationVersion": "0.1.0",
    "applicationInstanceId": "host-01",
    "observedAt": "2026-08-14T12:03:59.000Z"
  },
  "data": {
    "previousMode": "linked_legacy",
    "projectMode": "managed",
    "locationRef": "loc_0198f4b2-7c3a-7d36-a5c6-6b6f39e34736",
    "manifestHash": "sha256:5555555555555555555555555555555555555555555555555555555555555555",
    "fileSync": {
      "status": "committed",
      "planId": "pln_0198f4b2-7c3a-7d62-a5c6-6b6f39e34762",
      "planHash": "sha256:58616bd635fb42aca70dd87c7fa40abcc4c17607a900fd687dda85db93d67577",
      "manifestHash": "sha256:5555555555555555555555555555555555555555555555555555555555555555"
    }
  }
}
