{
  "protocolVersion": "project-control.dsh/v1alpha1",
  "schemaVersion": "lifecycle-normalized-event/v1alpha1",
  "eventId": "evt_0198f4b2-7c3a-7d73-a5c6-6b6f39e34773",
  "eventType": "project.managed.created",
  "occurredAt": "2026-08-14T12:02:00.000Z",
  "recordedAt": "2026-08-14T12:02:00.100Z",
  "sequence": 3,
  "actor": {
    "kind": "human",
    "id": "cyrus",
    "applicationId": "deepseek-harness-personal"
  },
  "target": {
    "aggregateType": "project",
    "projectId": "prj_0198f4b2-7c3a-7d13-a5c6-6b6f39e34713"
  },
  "beforeRevision": 0,
  "afterRevision": 1,
  "causation": {
    "commandId": "cmd_0198f4b2-7c3a-7d23-a5c6-6b6f39e34723",
    "commandKind": "project.createFromTemplate",
    "idempotencyKey": "project.create-template.001",
    "correlationId": "corr.lifecycle.create-template"
  },
  "provenance": {
    "sourceType": "human",
    "sourceId": "project-console:create-confirmation",
    "applicationVersion": "0.1.0",
    "applicationInstanceId": "host-01",
    "observedAt": "2026-08-14T12:01:59.000Z"
  },
  "data": {
    "projectMode": "managed",
    "name": "New Managed Project",
    "locationRef": "loc_0198f4b2-7c3a-7d33-a5c6-6b6f39e34733",
    "sourceRootRef": "srt_0198f4b2-7c3a-7d43-a5c6-6b6f39e34743",
    "template": {
      "templateId": "software-standard",
      "templateVersion": "1.0.0",
      "templateHash": "sha256:dddddddddddddddddddddddddddddddddddddddddddddddddddddddddddddddd"
    },
    "manifestHash": "sha256:ffffffffffffffffffffffffffffffffffffffffffffffffffffffffffffffff",
    "fileSync": {
      "status": "committed",
      "planId": "pln_0198f4b2-7c3a-7d61-a5c6-6b6f39e34761",
      "planHash": "sha256:f238e027d68d189d8b75d5f6a3fe3b7ac3d2b0821b7d016639e8342aea1e73dc",
      "manifestHash": "sha256:ffffffffffffffffffffffffffffffffffffffffffffffffffffffffffffffff"
    }
  }
}
